<?xml version="1.0" encoding="UTF-8"?>
<schema xmlns="http://www.w3.org/2001/XMLSchema" targetNamespace="http://www.example.org/MonTempiattrvThreshold" xmlns:tns="http://www.example.org/MonTempiattrvThreshold" elementFormDefault="qualified">

    <element name="rootList">
    	<complexType>
    		<sequence maxOccurs="1" minOccurs="0">

    			<choice maxOccurs="1" minOccurs="0">
    			    			<element name="items" maxOccurs="unbounded"
    				minOccurs="0">
    				<complexType>
    					<sequence>
    						<element name="tipoContatore" type="string"
    							maxOccurs="1" minOccurs="0">
    						</element>
    						<element name="statoRichiestaNow"
    							type="string" maxOccurs="1" minOccurs="0">
    						</element>
    						<element name="nomeSoglia" type="string"
    							maxOccurs="1" minOccurs="0">
    						</element>
    						<element name="tipoLavz" type="string"
    							maxOccurs="1" minOccurs="0">
    						</element>
    						<element name="offerta" type="string"
    							maxOccurs="1" minOccurs="0">
    						</element>
    					</sequence>
    				</complexType>
    			</element>
    			<element name="Resultset" maxOccurs="unbounded" minOccurs="0">
    				<complexType>
    					<sequence>
    						<element name="offerta" type="string"
    							maxOccurs="1" minOccurs="0">
    						</element>
    						<element name="tiplgLavrz" type="string"
    							maxOccurs="1" minOccurs="0">
    						</element>
    					</sequence>
    				</complexType>
    			</element>
    			
    			
    			</choice>
    		</sequence>
    	</complexType></element>
</schema>